context,declination,user,V2,V3,V4,V5,V6,V7,V8,V9,V10,confirmation_code,INTRO_1,ENG_1,CONSENT,IRB_FORM,AUDIO_1,TEST,AUDIO_2,INT1_2,INT2_2,INT3_3,INT_OTHER,AUDIO_3,EPI_S_1,EPI_S_2_2,AFF_S_2,SOC_1_2,SOC_2_2,INTP_S_2,SOC_OTHER,INTRO_2,AGE,GEN,HOME,LANG,LocationLatitude,LocationLongitude,LocationAccuracyint_1,rise_40,R_qUvqysgx97UO81j,Default Response Set,Anonymous,,,24.252.148.30,0,6/6/15 16:51,6/6/15 16:55,1,67332003,1,1,1,1,1,New fabric softener. ,1,21,12,89,None,1,2,90,13,20,85,88,None,1,3,2,Cleveland Ohio,English,41.38619995,-81.79149628,-1int_1,rise_40,R_2w7dw5WlSbKbMNu,Default Response Set,Anonymous,,,68.4.133.8,0,6/6/15 17:16,6/6/15 17:21,1,79998396,1,1,1,1,1,Fabric softener ,1,71,100,100,"He knows she wants to try out her new fabric softener, so he asks her if she wants to do the laundry.",1,4,,0,0,83,74,He seems friendly. Like a husband or boyfriend who is with her when she makes the statement about fabric softener.,1,5,1,Orange,English,33.60539246,-117.6674957,-1int_1,rise_40,R_2PcaKokJIH407z6,Default Response Set,Anonymous,,,72.238.221.58,0,6/6/15 17:29,6/6/15 17:35,1,25195625,1,1,1,1,1,fabric softener laundry,1,61,84,32,,1,2,75,28,26,85,69,,1,6,1,"Longwood, Florida",English,28.73129272,-81.51580048,-1int_1,rise_40,R_2xyGHoMQofjKsuu,Default Response Set,Anonymous,,,70.178.2.160,0,6/6/15 17:54,6/6/15 17:57,1,73285591,1,1,1,1,1,fabric softener,1,60,90,10,,1,2,85,0,20,65,85,tired,1,2,2,"Watertown, NY","English (native), Danish (basic)",36.30180359,-94.12149811,-1int_1,rise_40,R_822PUePPjpOYkHX,Default Response Set,Anonymous,,,98.193.225.125,0,6/6/15 19:28,6/6/15 19:40,1,76000949,1,1,1,1,1,fabric softener & laundry,1,74,32,47,no,1,2,75,9,45,86,92,clueless (she already said she was excited to try out the fabric softener),1,4,1,"Oakfield, NY",English,36.17179871,-86.49040222,-1int_1,rise_40,R_3LX5BqhH6xVTyL0,Default Response Set,Anonymous,,,24.183.7.197,0,6/6/15 20:53,6/6/15 20:58,1,15250017,1,1,1,1,1,Fabric softener,1,20,70,65,no,1,4,,20,25,70,60,Uninterested in the details of what the females is saying.  ,1,3,2,"Milwaukee, WI","English, Spanish",43.70979309,-87.74780273,-1int_1,rise_40,R_2xFbPM1HCrDfGQZ,Default Response Set,Anonymous,,,98.245.77.130,0,6/6/15 21:11,6/6/15 21:13,1,23441535,1,1,1,1,1,"buying new fabric softener and doing laundry, excited about the smell",1,19,46,56,no,1,2,95,51,45,16,43,irritated,1,2,1,"Shreveport, LA",English,39.70899963,-105.0910034,-1int_1,rise_40,R_2B3ZmxGpTuSjgnk,Default Response Set,Anonymous,,,76.125.33.80,0,6/7/15 3:48,6/7/15 3:53,1,60746703,1,1,1,1,1,"laundry, fabric softener ",1,76,69,80,no,1,2,60,0,31,76,86,helpful,1,5,1,Lodi,English,37.97529602,-121.3244019,-1int_1,rise_40,R_V2rjkvJijkBK3S1,Default Response Set,Anonymous,,,96.243.22.164,0,6/7/15 5:29,6/7/15 5:35,1,40582983,1,1,1,1,1,buying laundry fabric softener,1,86,86,90,He more focused on who going to do laundry.,1,4,,71,76,91,91,seems confused,1,6,1,buffalo,english,42.83560181,-78.74839783,-1int_1,rise_40,R_OevmELM2JrnTC4p,Default Response Set,Anonymous,,,172.56.26.58,0,6/7/15 5:32,6/7/15 5:38,1,77136573,1,1,1,1,1,"Laundry, fabric softener",1,80,30,30,Are you doing laundry today?,1,2,75,25,40,65,75,"He just sounds curious, not bored but it's the kind of conversation you'd hear all the time with a couple that lived together.",1,2,1,Kentucky,"English, Portuguese",25.76600647,-80.311203,-1int_1,rise_40,R_3GB55eGhfDHYG5M,Default Response Set,Anonymous,,,72.161.165.177,0,6/7/15 7:44,6/7/15 7:48,1,47835730,1,1,1,1,1,FABRIC SOFTNER,1,18,4,4,DO YOU WANT TO DO THE LAUNDRY?,1,4,95,16,49,93,81,NONE NOTED,1,5,2,BOISE,ENGLISH,34.94610596,-92.08580017,-1int_1,rise_40,R_BzE08GNyZvoKqCR,Default Response Set,Anonymous,,,174.19.127.161,0,6/7/15 7:49,6/7/15 7:56,1,23583591,1,1,1,1,1,Trying out fabric softener,1,100,0,0,"The laundry needs doing, let's try it out.",1,4,,0,0,100,100,I thought the male speaker was friendly.,1,5,1,"Pocatello, ID ",English,43.63400269,-116.3242035,-1int_1,rise_40,R_1ptgP3RPHdTT3fw,Default Response Set,Anonymous,,,54.148.44.119,0,6/7/15 8:21,6/7/15 8:26,1,66409802,1,1,1,1,1,laundry and fabric softener,1,20,95,15,should we test the new fabric softener out on some neutral fabric first?,1,2,80,80,70,10,60,he seems kind of cocky.  but it also seems like maybe he's attracted to the female speaker.,1,2,1,"Buffalo, NY","english, german",45.83990479,-119.7005997,-1int_1,rise_40,R_3RxPDvHE1FZWHQ4,Default Response Set,Anonymous,,,173.60.212.139,0,6/7/15 8:31,6/7/15 8:34,1,20810521,1,1,1,1,1,Washing clothes,1,82,98,53,no,1,2,98,4,72,97,85,no,1,3,1,middletown,english,34.42660522,-117.1450958,-1int_1,rise_40,R_12guN4e9BvB61Uu,Default Response Set,Anonymous,,,71.10.2.15,0,6/7/15 9:47,6/7/15 9:49,1,16472096,1,1,1,1,1,Fabric softener,1,51,100,56,"No, I believe he meant for her to do the laundry so they can test out the fabric softener.",1,4,,0,0,71,51,He seemed friendly and curious,1,2,1,Montague,English,43.38470459,-86.32720184,-1int_1,rise_40,R_2TYpjlMvYrXuVp9,Default Response Set,Anonymous,,,162.232.66.22,0,6/7/15 10:49,6/7/15 10:55,1,49406004,1,1,1,1,1,new fabric softner,1,50,0,50,,1,2,80,80,30,10,19,dominant,1,2,1,Warrenville,"English, french, spanish",41.76530457,-88.3769989,-1int_1,rise_40,R_2wsOp6jnP5YWqGi,Default Response Set,Anonymous,,,76.117.241.65,0,6/7/15 10:56,6/7/15 11:00,1,58357643,1,1,1,1,1,Fragrent Fabric Softener,1,50,80,60,Really lame inuendo. ,1,4,,30,25,50,50,He sounds more casual to me than anything else.,1,3,2,New Egypt,English,40.08039856,-74.45809937,-1int_1,rise_40,R_XMrwbTnYs1wjbMJ,Default Response Set,Anonymous,,,50.156.191.51,0,6/7/15 12:45,6/7/15 12:47,1,47391597,1,1,1,1,1,new fabric softner,1,14,86,73,No,1,3,52,20,64,47,60,no,1,3,2,Tallahassee,English,30.3993988,-84.17250061,-1no_int,rise_40,R_1qaAL9mV6NxwRoe,Default Response Set,Anonymous,,,76.28.32.243,0,5/18/15 15:54,5/18/15 15:56,1,18220239,1,1,1,1,1,do you want to do the laundry,1,49,51,34,,1,4,,11,20,43,50,no,1,2,2,woolwich,english,43.89880371,-69.97250366,-1no_int,rise_40,R_DvNaiDodqXcS9Xz,Default Response Set,Anonymous,,,66.31.200.171,0,5/18/15 15:57,5/18/15 15:59,1,52058597,1,1,1,1,1,Do you wanna do the laundry?,1,100,60,19,"""Does the laundry need to be done now rather than something else?""",1,4,82,0,7,95,100,no,1,3,1,Philadelphia,English,42.36459351,-71.10279846,-1no_int,rise_40,R_1Qg9qJxVUq5ktpn,Default Response Set,Anonymous,,,50.148.52.246,0,5/18/15 21:56,5/18/15 21:57,1,39499329,1,1,1,1,1,Do you wanna do the laundry?,1,77,70,91,Asking if the other person will be able to do it soon.,1,4,,26,35,33,84,Seems dispassionate.,1,2,2,Chicago,"English, Spanish, Chinese, Portugese",42.05619812,-87.70110321,-1no_int,rise_40,R_6upjez7E5nUNaIp,Default Response Set,Anonymous,,,71.224.31.232,0,6/4/15 12:55,6/4/15 12:58,1,51456626,1,1,1,1,1,Do you want to do the laundry?,1,57,92,41,,1,4,,11,11,75,78,"Not really, inquiring maybe.",1,2,1,Pennsburg,English,40.26049805,-75.6155014,-1no_int,rise_40,R_RKradp7cdBx4Oc1,Default Response Set,Anonymous,,,68.188.244.162,0,6/4/15 12:57,6/4/15 12:59,1,98366655,1,1,1,1,1,Do you want to do the laundry?,1,23,94,26,None,1,4,,20,8,75,75,None,1,4,2,Midland,English,43.70530701,-84.23770142,-1no_int,rise_40,R_7UGi4g1VFRniGLT,Default Response Set,Anonymous,,,24.24.131.40,0,6/4/15 12:56,6/4/15 13:00,1,35448751,1,1,1,1,1,Do you want to do the laundry?,1,80,61,70,no,1,4,,0,40,100,100,no,1,5,1,North Hollywood,English,34.14630127,-118.4292984,-1no_int,rise_40,R_3ehoHjHbQFWFzh6,Default Response Set,Anonymous,,,99.46.85.25,0,6/4/15 13:00,6/4/15 13:04,1,91174493,1,1,1,1,1,do you want to do the laundry,1,40,90,20,no,1,4,,10,30,80,80,seemed friendly and nice,1,3,2,los angeles,"english, french, farsi",34.36669922,-118.4775009,-1no_int,rise_40,R_uk0UGx6mFz6mW7n,Default Response Set,Anonymous,,,68.4.204.151,0,6/6/15 11:00,6/6/15 11:03,1,97351503,1,1,1,1,1,Do you want to do the laundry?,1,5,20,85,no,1,4,,12,80,91,73,They sounded friendly and polite based off their tone of voice.,1,1,1,Mission VIejo,English,33.64509583,-117.6786041,-1no_int,rise_40,R_2fvedFa5yUtjKYO,Default Response Set,Anonymous,,,108.88.1.54,0,6/7/15 10:58,6/7/15 11:01,1,69410666,1,1,1,1,1,Do you wanna do the laundry?,1,40,100,90,,1,4,,10,30,70,90,"Patient, friendly",1,2,1,"South Bend, Indiana",English,41.66419983,-86.22180176,-1no_int,rise_40,R_2vkT4Bd3T3Dk28i,Default Response Set,Anonymous,,,54.148.44.119,0,6/7/15 18:39,6/7/15 18:41,1,30217303,1,1,1,1,1,Do you want to do the laundry,1,7,68,71,Your turn to do laundry,1,3,52,43,21,46,48,impatient,1,5,1,Buffalo,"English, Spanish",45.83990479,-119.7005997,-1no_int,rise_40,R_5hzGMZFqLyDkgnv,Default Response Set,Anonymous,,,75.167.170.139,0,6/8/15 14:16,6/8/15 14:20,1,37081424,1,1,1,1,1,Do you want to do the laundry?,1,77,39,70,no that covers,1,4,48,34,41,80,36,They sound genuinely concerned. ,1,2,2,Boise ,english,43.61210632,-116.3914948,-1no_int,rise_40,R_tLMqAs58SurywdX,Default Response Set,Anonymous,,,207.255.62.80,0,6/9/15 6:25,6/9/15 6:28,1,60981774,1,1,1,1,1,do you want to do the laundry?,1,10,99,7,,1,4,11,51,12,35,53,optimistic,1,3,1,saxton,English,40.20410156,-77.95020294,-1no_int,rise_40,R_eqvrepczeydyked,Default Response Set,Anonymous,,,99.2.96.126,0,6/9/15 11:39,6/9/15 11:42,1,95538056,1,1,1,1,1,Do you want to do the laundry?,1,91,91,32,No,1,4,,0,20,81,80,No,1,5,1,"Lithonia, Georgia",English,33.74110413,-84.10929871,-1no_int,rise_40,R_5d6ynqYmGNTyPUB,Default Response Set,Anonymous,,,12.34.160.162,0,6/10/15 11:40,6/10/15 11:46,1,91354011,1,1,1,1,1,Do you want to do the lanudry?,1,2,80,10,No,1,4,10,10,2,2,50,A little frustrated,1,6,1,"St. Louis, MO",English,38.78900146,-90.38289642,-1no_int,rise_40,R_eKaVzel6tgslmeJ,Default Response Set,Anonymous,,,50.139.156.134,0,6/10/15 14:29,6/10/15 14:34,1,63232054,1,1,1,1,1,Do you want to fo the laundry?,1,0,49,0,Do you want to wash clothes?,1,4,,0,0,4,51,,1,5,1,Lawrence,English,42.86450195,-71.04270172,-1no_int,rise_40,R_2vjJdKLFMBofmOJ,Default Response Set,Anonymous,,,69.145.3.126,0,6/10/15 19:18,6/10/15 19:22,1,95139533,1,1,1,1,1,Do you want to do the laundry?,1,80,50,39,Can't think of anything else off the top of my head.,1,4,,0,11,69,70,"Friendly, gently probing",1,5,2,Minneapolis,English,41.10339355,-104.905899,-1no_int,rise_40,R_CgF1TsWSdnguqml,Default Response Set,Anonymous,,,76.188.227.52,0,6/10/15 19:25,6/10/15 19:29,1,87162436,1,1,1,1,1,do you want to do the laundry,1,20,30,51,n/a,1,4,,0,1,71,71,,1,2,1,"Canton, OH",English,40.81719971,-81.43849945,-1no_int,rise_40,R_3KZsTOHw3yHWxJO,Default Response Set,Anonymous,,,72.170.231.160,0,6/11/15 0:57,6/11/15 1:02,1,40218012,1,1,1,1,1,do you want to do the laundry?,1,72,92,11,"we should do the laundry, ",1,4,,1,61,92,82,he sounded very friendly and sincere,1,5,2,glendale,english,38,-97,-1no_int,rise_40,R_2aJ3K3rz1tABUKY,Default Response Set,Anonymous,,,75.1.96.15,0,6/11/15 7:16,6/11/15 7:19,1,78653445,1,1,1,1,1,do you want to do the laundry,1,100,0,0,none,1,4,99,53,72,53,36,Passive aggressive,1,2,1,Jackson Mississippi,English,29.522995,-98.52700043,-1no_int,rise_40,R_vizZbucnfGU6QO5,Default Response Set,Anonymous,,,50.88.230.23,0,6/11/15 11:05,6/11/15 11:07,1,91243813,1,1,1,1,1,do you want to do the laundry?,1,18,73,55,,1,4,38,36,42,45,48,no,1,3,1,"Titusville, FL",english,28.0717926,-80.62400055,-1int_1,rise_80,R_SDj2n46GC04Y7dv,Default Response Set,Anonymous,,,128.172.35.15,0,6/5/15 11:36,6/5/15 11:38,1,64061541,1,1,1,1,1,fabric softener,1,75,99,82,,1,4,56,3,18,89,84,"he seems friendly, like he wants to help her",1,3,1,"Alexandria, Virginia",English,37.55380249,-77.46029663,-1int_1,rise_80,R_25Mfqx2YNUFbIx8,Default Response Set,Anonymous,,,75.166.93.98,0,6/5/15 11:36,6/5/15 11:41,1,19494867,1,1,1,1,1,fabric softener and laundry,1,20,100,90,no,1,4,,0,60,90,85,"no, not really",1,6,1,"Mt. Clemens, MI",english,39.63839722,-104.9057999,-1int_1,rise_80,R_3kFL4zzzeAqId2p,Default Response Set,Anonymous,,,74.8.119.71,0,6/5/15 11:40,6/5/15 11:43,1,57078993,1,1,1,1,1,New detergent and laundry,1,28,51,85,No,1,2,71,15,53,51,56,he sounded boring,1,2,1,"Springfield, Massachusetts",English,42.30990601,-71.12020111,-1int_1,rise_80,R_pxw03BaQKfK0v5f,Default Response Set,Anonymous,,,202.52.230.23,0,6/5/15 11:40,6/5/15 11:45,1,65825068,1,1,1,1,1,Bought a fabric softner,1,57,90,9,,1,4,48,3,30,74,36,,1,2,2,New York,English,27.71670532,85.31671143,-1int_1,rise_80,R_1mx5ncnNcXxx026,Default Response Set,Anonymous,,,24.154.177.125,0,6/5/15 11:41,6/5/15 11:46,1,55674200,1,1,1,1,1,new fabric softener,1,10,79,0,He's just saying since she liked the new softener maybe she wanted to try it out by doing the laundry.,1,4,,0,20,91,80,He sounds young and caring,1,6,1,"Butler, PA",English,40.91400146,-79.93199921,-1int_1,rise_80,R_2z6d5XxCRmG8R5Y,Default Response Set,Anonymous,,,173.66.227.107,0,6/5/15 11:44,6/5/15 11:47,1,34341446,1,1,1,1,1,fabric softener,1,50,80,0,No,1,4,50,0,40,90,82,,1,3,1,"Saginaw, MI",English,38.58299255,-77.31580353,-1int_1,rise_80,R_1K7vPvhIXfMPZ36,Default Response Set,Anonymous,,,69.133.117.63,0,6/5/15 11:44,6/5/15 11:49,1,52256444,1,1,1,1,1,fabric softener,1,0,100,0,,1,4,,1,0,70,50,tentative; henpecked,1,6,1,"Troy, Oh",English; some French,40.03579712,-84.17749786,-1int_1,rise_80,R_ZlVjVm1SQL9VyfL,Default Response Set,Anonymous,,,69.55.117.38,0,6/5/15 11:45,6/5/15 11:49,1,23431154,1,1,1,1,1,fabric softener purchase ,1,3,93,80,no,1,4,,1,4,100,94,no,1,3,2,algoma,english,36.38679504,-85.3082962,-1int_1,rise_80,R_2Cwc96n4F4z6l2q,Default Response Set,Anonymous,,,98.189.67.2,0,6/5/15 11:52,6/5/15 11:54,1,21055281,1,1,1,1,1,bought fabric softener,1,0,0,47,,1,4,,0,0,100,100,,1,2,2,california,english,33.63780212,-117.8095016,-1int_1,rise_80,R_O22qWon6qKN2voR,Default Response Set,Anonymous,,,54.174.77.195,0,6/5/15 11:49,6/5/15 11:55,1,56505343,1,1,1,1,1,laundry fabric softner,1,19,12,70,,1,4,,13,31,90,91,friendly and agreable,1,6,2,Monroe NC,English,39.04370117,-77.48750305,-1int_1,rise_80,R_bIdG3SKt5a7BFwl,Default Response Set,Anonymous,,,78.223.69.144,0,6/5/15 11:52,6/5/15 11:55,1,45140998,1,1,1,1,1,fabric softener laundry,1,20,100,60,no,1,4,,0,60,76,91,could be sarcastic,1,2,1,"Tampa, FL","English, French",43.56669617,7.016693115,-1int_1,rise_80,R_OdTAANOXGufYqHv,Default Response Set,Anonymous,,,73.203.18.70,0,6/5/15 11:52,6/5/15 11:56,1,35221449,1,1,1,1,1,"laundry, new fabric softener",1,2,81,2,,1,2,61,20,32,70,81,"attentive, he listened to the female (can't wait to try it out) and is asking her if she wants to try it out so she can smell it",1,2,1,Tucson,English,38.83389282,-104.8214035,-1int_1,rise_80,R_ahOcU0vu4upRHLb,Default Response Set,Anonymous,,,76.26.175.59,0,6/5/15 11:55,6/5/15 11:59,1,14287717,1,1,1,1,1,fabric softener laundry,1,4,19,90,"I don't feel like doing the laundry, so you do it.",1,2,72,0,7,96,82,none,1,4,1,"Hancock, NH",English,27.51150513,-80.36250305,-1int_1,rise_80,R_3MlHcx7q8xoJE9d,Default Response Set,Anonymous,,,71.1.109.253,0,6/5/15 11:55,6/5/15 12:00,1,61008682,1,1,1,1,1,a new fabric  sofltener they purchased,1,49,100,0,"no, cannnot think of any",1,4,,60,49,70,29,"yes, concerning the fascination of the female by the softener",1,4,1,"chicago, il",english,38.55160522,-92.27449799,-1int_1,rise_80,R_3IWfU73CaU4oVrz,Default Response Set,Anonymous,,,173.192.176.184,0,6/5/15 11:48,6/5/15 12:04,1,46905135,1,1,1,1,1,fabric softener,1,33,64,65,no,1,4,62,47,60,42,66,no,1,3,2,seattle,english,47.60620117,-122.3320999,-1int_1,rise_80,R_2CKi0z4PRrrZx7H,Default Response Set,Anonymous,,,63.73.199.69,0,6/5/15 11:59,6/5/15 12:04,1,71329750,1,1,1,1,1,Fabric softner,1,80,20,20,No. It sounds like do you want to do the laundry together.,1,2,70,10,30,90,80,None,1,4,2,San Antonio,English,42.12860107,-87.92369843,-1int_1,rise_80,R_27rIJxuSa6uKt8m,Default Response Set,Anonymous,,,70.209.20.205,0,6/5/15 12:12,6/5/15 12:14,1,56262635,1,1,1,1,1,doing laundry,1,41,100,1,Let me bring you my laundry and you can try out the new fabric softner,1,4,,20,13,70,50,impatient,1,3,1,Orlando fl,English,29.18719482,-82.14009857,-1int_1,rise_80,R_UMYjE1Lvp0GasQF,Default Response Set,Anonymous,,,54.148.44.119,0,6/5/15 12:14,6/5/15 12:17,1,68772815,1,1,1,1,1,fabric softner,1,91,60,20,Try it out by doing the laundry.,1,4,,5,9,73,89,suggestive,1,2,1,Atlanta,English,45.83990479,-119.7005997,-1int_1,rise_80,R_3HtdygdFPxTsUL2,Default Response Set,Anonymous,,,160.94.230.162,0,6/5/15 11:44,6/5/15 12:18,1,88806814,1,1,1,1,1,"Woman says she just bought fabric softener and can't wait to try it, then a man asks if she wants to do laundry.",1,4,51,90,surprise.. You want to do laundry?,1,4,,11,9,75,49,hesitant ,1,5,1,Minneapolis,English,44.97590637,-93.21659851,-1int_1,rise_80,R_3MDnuHoU5v3AKk5,Default Response Set,Anonymous,,,68.169.146.32,0,6/5/15 12:18,6/5/15 12:21,1,12591658,1,1,1,1,1,Using a new fabric softener and doing the laundry.,1,37,100,73,Would you care to wash the clothes?,1,2,80,5,55,50,50,The male speaker seemed friendly and simply asked the female speaker if she wanted to do the laundry.,1,2,1,"Cleveland, Ohio","English, Mandarin",35.13000488,-85.29070282,-1int_1,rise_80,R_2VvZPEKHcTPY1YS,Default Response Set,Anonymous,,,68.186.191.13,0,6/5/15 12:20,6/5/15 12:23,1,60106852,1,1,1,1,1,doing laundry,1,0,100,0,"He said ""Do you want to do the laundry"" not ""We should do the laundry"".",1,2,100,0,40,100,100,None,1,5,1,Arab,English,34.25190735,-86.25710297,-1int_1,rise_80,R_2cnZVvpUDrNRdh3,Default Response Set,Anonymous,,,24.102.212.61,0,6/5/15 12:19,6/5/15 12:24,1,53604663,1,1,1,1,1,DOIN LAUNDRY WITH A NEW FABRIC SOFTNER,1,20,100,9,would you like to do the laundry?,1,4,,0,13,92,89,"he sounded fine, I think he was just asking her if she wanted to do the laundry, nothing else to read into it.",1,5,1,hometown,english,40.82470703,-75.84600067,-1int_1,rise_80,R_1i53MnaCeuyTkjs,Default Response Set,Anonymous,,,173.31.49.165,0,6/5/15 12:28,6/5/15 12:33,1,85635892,1,1,1,1,1,fabric softner,1,38,47,20,no,1,2,48,65,46,58,54,no,1,2,1,valdosta,english,30.8717041,-83.33339691,-1int_1,rise_80,R_SYTTTupHFlo0fe1,Default Response Set,Anonymous,,,54.174.77.195,0,6/5/15 12:23,6/5/15 12:38,1,74707020,1,1,1,1,1,doing the laundry,1,75,81,49,,1,4,,10,16,80,41,,1,3,2,Philadelphia,English,39.04370117,-77.48750305,-1int_1,rise_80,R_1H6RMhzf2NAMOv2,Default Response Set,Anonymous,,,76.212.189.17,0,6/5/15 12:42,6/5/15 12:47,1,53263730,1,1,1,1,1,Fabric softener ,1,10,30,70,Let's do the laundry to see what it smells like,1,2,80,0,20,60,70,"I think the male speaker is friendly, mild-mannered, and easy-going",1,3,1,San Diego,"English, some Spanish",32.72079468,-117.0931015,-1int_1,rise_80,R_2S6N2BZRxOFhcs9,Default Response Set,Anonymous,,,75.108.191.200,0,6/5/15 13:00,6/5/15 13:02,1,79288008,1,1,1,1,1,fabric softener and laundry,1,85,46,52,No.,1,4,22,13,20,85,70,"Friendly, chill.",1,1,1,"Kingwood, TX (Houston)",English,30.05400085,-95.22299957,-1int_1,rise_80,R_3jW0SNafz2h7OO7,Default Response Set,Anonymous,,,166.170.55.175,0,6/5/15 13:29,6/5/15 13:34,1,38781728,1,1,1,1,1,bought fabric softener,1,21,92,60,can't think of any other possible interpretation or paraphrase,1,2,71,1,50,100,92,"young (late 20's), friendly, optimistic, easy to get along with, attracted to the female, not snobbish",1,6,2,Birmingham AL,English,38,-97,-1int_1,rise_80,R_1EchsYm0BToZbPr,Default Response Set,Anonymous,,,108.3.144.137,0,6/5/15 13:30,6/5/15 13:35,1,41374486,1,1,1,1,1,They are discussing laundry. The woman says she bought some good-smelling fabric softener.,1,50,100,50,Maybe he means he'd like to know that she is taking responsibility to get the laundry done.,1,2,90,0,60,100,100,He is friendly and optimistic.,1,6,1,"Baltimore, Maryland",only English,39.37879944,-76.81390381,-1int_1,rise_80,R_DbZ8bbtsEwsfymt,Default Response Set,Anonymous,,,184.210.244.203,0,6/5/15 13:33,6/5/15 13:48,1,67074253,1,1,1,1,1,FABRIC SOFTNER,1,100,91,91,ARE YOU GOING TO DO THE LAUNDRY?,1,2,10,21,20,90,100,HE WAS VERY FRIENDLY,1,3,1,HOLLYWOOD,ENGLISH,38,-97,-1int_1,rise_80,R_sX6syB1iKDtnJbH,Default Response Set,Anonymous,,,74.69.236.166,0,6/5/15 14:52,6/5/15 14:54,1,73326637,1,1,1,1,1,Laundry and fabric softner ,1,86,100,25,No,1,2,57,0,62,98,85,No impressions,1,3,1,"Acworth, NH",English,42.9703064,-72.27999878,-1no_int,rise_80,R_2tGB4r2cDMST8B3,Default Response Set,Anonymous,,,174.44.89.104,0,5/18/15 18:21,5/18/15 18:24,1,47750081,1,1,1,1,1,Do you want to do the laundry?,1,49,58,65,Does the laundry need to be done?,1,4,50,40,44,63,61,no i think he is sincere,1,3,1,new york,english,40.93339539,-73.75630188,-1no_int,rise_80,R_emacP1oQZuB2idj,Default Response Set,Anonymous,,,50.148.52.246,0,5/18/15 21:57,5/18/15 21:58,1,62046708,1,1,1,1,1,Do you wanna do the laundry?,1,81,79,22,no,1,3,26,38,34,55,80,No,1,2,2,Chicago,"English, Spanish, Chinese, Portugese",42.05619812,-87.70110321,-1no_int,rise_80,R_31BKp9N9uDWCe2j,Default Response Set,Anonymous,,,68.43.25.12,0,5/19/15 1:31,5/19/15 1:35,1,33627162,1,1,1,1,1,Do you want to do the laundry?,1,60,100,50,No I can't think of any other interpretations.,1,4,,1,10,100,100,No.,1,3,1,Michigan,English,42.28120422,-83.17949677,-1no_int,rise_80,R_3KCt6E0dB3E86aY,Default Response Set,Anonymous,,,173.81.64.140,0,5/19/15 6:22,5/19/15 6:33,1,58387961,1,1,1,1,1,Do you want to do the laundry?,1,50,90,10,"Do you want to do ""my"" laundry?",1,4,,0,20,90,95,No impressions.,1,5,2,"Marietta, Ohio",English,39.44110107,-81.34660339,-1no_int,rise_80,R_1d7cUq0s4kLKZ0x,Default Response Set,Anonymous,,,73.11.23.206,0,5/20/15 13:47,5/20/15 13:50,1,78671411,1,1,1,1,1,Do you want to do the laundry?,1,71,98,36,,1,4,,0,30,100,85,,1,5,1,Kelso,"English, Hungarian",46.14909363,-122.8088989,-1no_int,rise_80,R_3KuzB9rtkKnUJfl,Default Response Set,Anonymous,,,76.178.171.86,0,6/4/15 12:52,6/4/15 12:54,1,81090358,1,1,1,1,1,Do you want to do the laundry?,1,0,50,75,No.,1,4,1,16,20,39,50,non-chalant,1,2,2,"Hayden, Idaho",Spanish,47.78869629,-116.7111969,-1no_int,rise_80,R_12stmoI1I3Nf9xy,Default Response Set,Anonymous,,,173.189.239.165,0,6/4/15 12:52,6/4/15 12:54,1,78886159,1,1,1,1,1,do you want to do the laundry,1,32,77,78,Lets do laundry,1,2,84,17,64,77,80,no he sounded nice and clear,1,2,2,Altoona PA,English,40.16340637,-76.39499664,-1no_int,rise_80,R_3pg3fh6Dy94BCGf,Default Response Set,Anonymous,,,76.172.49.142,0,6/4/15 12:52,6/4/15 12:56,1,44598507,1,1,1,1,1,Do you wanna do the laundry?,1,0,100,0,,1,4,,0,0,0,50,,1,4,1,hawaii,english,21.37750244,-158.0861969,-1no_int,rise_80,R_3g7sfdZ2IkCMFNH,Default Response Set,Anonymous,,,68.183.116.115,0,6/4/15 12:54,6/4/15 12:56,1,91074549,1,1,1,1,1,Do you want to do the laundry?,1,33,80,37,Do you wanna cry together?,1,4,,13,20,96,98,friendly,1,2,2,corona,"vietnamese, english",33.84170532,-118.0075989,-1no_int,rise_80,R_2YGog5mzZW76d28,Default Response Set,Anonymous,,,108.250.114.122,0,6/4/15 12:52,6/4/15 12:56,1,16727492,1,1,1,1,1,Do you wanna do the laundry?,1,70,41,76,Really? You want to do the laundry?,1,4,,0,16,91,80,no,1,6,1,"Fulton, KY",English,37.32679749,-87.46959686,-1no_int,rise_80,R_3Gq6MC4IBWETqbP,Default Response Set,Anonymous,,,67.250.44.226,0,6/4/15 12:55,6/4/15 12:56,1,52017960,1,1,1,1,1,do you want to do the laundry,1,33,61,34,,1,4,59,12,56,64,76,he sounds friendly,1,2,2,New York,English,40.71679688,-73.98609924,-1no_int,rise_80,R_2eOxfFhQx3fG5jp,Default Response Set,Anonymous,,,96.42.50.222,0,6/4/15 12:54,6/4/15 12:57,1,97452567,1,1,1,1,1,do you wanna do the laundry?,1,1,100,1,,1,4,10,100,100,50,100,seems nice. but sounded like a question that you are not allowed to decline.,1,3,2,"Holmen, WI",English,43.79820251,-91.12860107,-1no_int,rise_80,R_ymsuCcUK4lcAz2V,Default Response Set,Anonymous,,,73.204.67.134,0,6/4/15 12:54,6/4/15 12:58,1,12254990,1,1,1,1,1,Do you want to do the laundry,1,20,50,30,,1,4,,10,35,80,90,,1,5,2,Weston,English,26.12089539,-80.12729645,-1no_int,rise_80,R_2qpUp8ZwCfFH3bs,Default Response Set,Anonymous,,,73.131.97.2,0,6/4/15 12:56,6/4/15 12:58,1,49365558,1,1,1,1,1,Do you want to do the laundry?,1,46,91,60,,1,4,,8,28,51,58,,1,3,2,"Columbia, SC",English,32.70809937,-79.94380188,-1no_int,rise_80,R_uxppT3hcdVtbAS5,Default Response Set,Anonymous,,,96.229.116.124,0,6/4/15 12:54,6/4/15 12:58,1,50473426,1,1,1,1,1,Do you want to do the laundry?,1,24,91,23,None,1,4,,8,10,91,50,inquisitive,1,2,2,Los Angeles,English,34.02810669,-117.9328003,-1no_int,rise_80,R_s6y6jiX70gvJ4hb,Default Response Set,Anonymous,,,72.66.124.145,0,6/4/15 12:54,6/4/15 13:00,1,53690371,1,1,1,1,1,Do you want to do the laundry?,1,90,60,10,"Would you like to do the laundry, or should I do it instead?",1,2,65,5,5,75,75,I think he is trying to be friendly and polite in indirectly suggesting that he and the person to whom he's speaking should do the laundry together.,1,3,1,"Stafford, VA",English,38.43359375,-77.38870239,-1no_int,rise_80,R_10Jm3Yek2Z4JYRr,Default Response Set,Anonymous,,,104.34.66.128,0,6/4/15 13:27,6/4/15 13:33,1,30780011,1,1,1,1,1,Do you want to do the laundry?,1,93,57,34,,1,4,32,20,17,76,56,,1,3,2,Los Angeles,Englihs,34.15530396,-118.5475998,-1no_int,rise_80,R_3KVgn9hewjWv2IK,Default Response Set,Anonymous,,,50.14.110.44,0,6/4/15 16:02,6/4/15 16:04,1,20572210,1,1,1,1,1,do you want to do the laundry?,1,10,100,40,,1,4,,25,73,62,45,,1,2,1,"brooklyn, ny",english,40.69200134,-73.92680359,-1no_int,rise_80,R_3JC62CmKdp58uSM,Default Response Set,Anonymous,,,108.53.16.231,0,6/8/15 1:26,6/8/15 1:33,1,84152992,1,1,1,1,1,Do you want to do the laundry?,1,95,0,5,I think it is quite reasonable that the speaker's question implies that he and the other do the laundry together?,1,4,,0,0,100,100,I got the impression that the speaker is a sincere and jovial individual.,1,5,2,"Roselle, NJ",English and Spanish,40.65060425,-74.26000214,-1no_int,rise_80,R_2V8BmoYBPpzTWxj,Default Response Set,Anonymous,,,173.227.7.146,0,6/8/15 18:07,6/8/15 18:13,1,28523263,1,1,1,1,1,Do you want to do the laundry?,1,0,95,0,No.,1,4,,20,40,80,70,He sounded friendly in the audio file. ,1,3,1,Los Angeles,English,34.09640503,-117.9667969,-1